{
  "ir_version": "0.1.0",
  "series": {
    "id": "series_yuye",
    "title": "雨夜反击",
    "logline": "被上司抢走方案、雨夜被辞退的设计师，在离职纸箱里发现一枚神秘 U 盘，决定当众反击。",
    "genre": "都市逆袭",
    "visual_style": "写实电影感，冷蓝色雨夜与暖黄室内形成对比，浅景深",
    "aspect_ratio": "9:16",
    "language": "zh-CN"
  },
  "characters": [
    {
      "id": "char_suwan",
      "name": "苏晚",
      "gender": "female",
      "age": 26,
      "role": "protagonist",
      "bio": "入职三年的设计师，方案被上司据为己有后遭到辞退，隐忍但不服输。",
      "appearance": "黑色及肩直发，淡妆，眼神倔强，身高约 165 厘米，身形偏瘦",
      "costume": "米白色针织开衫、浅蓝衬衫、黑色直筒裤、白色帆布鞋",
      "voice": "年轻女声，清亮偏柔；委屈时带鼻音，反击时低而坚定"
    },
    {
      "id": "char_luchen",
      "name": "陆沉",
      "gender": "male",
      "age": 32,
      "role": "antagonist",
      "bio": "设计总监，表面温和有礼，暗中窃取下属的方案署名。",
      "appearance": "短发背头，金丝眼镜，轮廓分明，身高约 183 厘米",
      "costume": "深灰色三件套西装、银色腕表",
      "voice": "低沉男声，语速偏慢，客气里带着压迫感"
    }
  ],
  "episodes": [
    {
      "id": "ep01",
      "number": 1,
      "title": "纸箱里的U盘",
      "synopsis": "雨夜，苏晚被辞退，上司陆沉假意撑伞、冷言嘲讽。回到出租屋，她在纸箱底发现一枚不属于自己的 U 盘，里面是陆沉窃取方案的监控录像。第二天的方案评审会上，她带着录像当众质问陆沉，却收到一条陌生短信：他不是一个人。",
      "target_duration_s": 60,
      "scenes": [
        {
          "scene_id": "ep01_sc01",
          "setting": {
            "location": "写字楼门口",
            "int_ext": "EXT",
            "time_of_day": "night",
            "description": "玻璃幕墙写字楼门口的台阶，大雨，积水映着霓虹"
          },
          "summary": "苏晚抱着纸箱被辞退，陆沉撑伞嘲讽，苏晚发誓拿回方案",
          "mood": "sad",
          "shots": [
            {
              "shot_id": "ep01_sc01_sh01",
              "duration": {
                "hint_s": 4.5
              },
              "framing": {
                "shot_size": "ELS",
                "angle": "overhead",
                "movement": "static",
                "composition": "竖屏俯拍写字楼门口，旋转门位于画面中上部，霓虹积水在下方，底部1/4为字幕与平台UI安全区，人物不进入该区域"
              },
              "description": "雨夜俯拍玻璃幕墙写字楼门口，旋转门缓缓转动，地面积水映着红蓝霓虹，门口空无一人，雨丝在灯光下清晰可见",
              "lighting": "冷蓝色雨夜霓虹，积水反光",
              "characters": [],
              "dialogue": [],
              "sfx": [
                "大雨声",
                "旋转门转动声"
              ]
            },
            {
              "shot_id": "ep01_sc01_sh02",
              "duration": {
                "hint_s": 4.5
              },
              "framing": {
                "shot_size": "LS",
                "angle": "eye_level",
                "movement": "push_in",
                "composition": "苏晚位于画面中央偏上，纸箱抱在胸前，旋转门在身后，底部1/4留字幕安全区"
              },
              "description": "苏晚抱着牛皮纸纸箱从旋转门走出，停在写字楼台阶上，大雨很快打湿她的黑色及肩直发，她强忍泪水抿着嘴唇",
              "lighting": "冷蓝雨夜顶光，湿润反光",
              "characters": [
                {
                  "character_id": "char_suwan",
                  "action": "抱着纸箱走出旋转门，停在台阶上",
                  "emotion": "悲伤，强忍泪水"
                }
              ],
              "dialogue": [
                {
                  "line_id": "l_0001",
                  "speaker": "char_suwan",
                  "kind": "voiceover",
                  "text": "入职三年，我只用了十分钟收拾工位。",
                  "delivery": {
                    "emotion": "sad",
                    "intensity": 0.4,
                    "speed": 0.9
                  }
                }
              ],
              "sfx": [
                "脚步踩水声",
                "雨声"
              ]
            },
            {
              "shot_id": "ep01_sc01_sh03",
              "duration": {
                "hint_s": 3.0
              },
              "framing": {
                "shot_size": "MCU",
                "angle": "high",
                "movement": "static",
                "composition": "苏晚居中偏上，雨水从发梢滴落，纸箱边缘入画，底部1/4留字幕安全区"
              },
              "description": "苏晚抱着纸箱站在台阶上，低头看着积水里自己模糊的倒影，雨水顺着脸颊滑落",
              "lighting": "冷蓝侧逆光，雨丝发亮",
              "characters": [
                {
                  "character_id": "char_suwan",
                  "action": "低头看积水倒影，纸箱抱紧",
                  "emotion": "失落，隐忍"
                }
              ],
              "dialogue": [
                {
                  "line_id": "l_0002",
                  "speaker": "char_suwan",
                  "kind": "voiceover",
                  "text": "我以为，努力就够了。",
                  "delivery": {
                    "emotion": "sad",
                    "intensity": 0.5,
                    "speed": 0.9
                  }
                }
              ],
              "sfx": [
                "雨声"
              ]
            },
            {
              "shot_id": "ep01_sc01_sh04",
              "duration": {
                "hint_s": 3.5
              },
              "framing": {
                "shot_size": "MS",
                "angle": "low",
                "movement": "tracking",
                "composition": "黑伞从画面上方入画遮住苏晚头顶，陆沉在高一级台阶形成压迫感，苏晚居中偏下，底部1/4留字幕安全区"
              },
              "description": "一把黑伞遮到苏晚头顶，陆沉站在高一级台阶上俯视她，金丝眼镜映着霓虹，似笑非笑，苏晚回头错愕",
              "lighting": "冷蓝雨夜，伞下阴影与霓虹轮廓光",
              "characters": [
                {
                  "character_id": "char_suwan",
                  "action": "回头看向身后的陆沉",
                  "emotion": "错愕"
                },
                {
                  "character_id": "char_luchen",
                  "action": "举伞站在高一级台阶俯视苏晚",
                  "emotion": "似笑非笑"
                }
              ],
              "dialogue": [],
              "sfx": [
                "雨打伞面声"
              ]
            },
            {
              "shot_id": "ep01_sc01_sh05",
              "duration": {
                "hint_s": 3.5
              },
              "framing": {
                "shot_size": "MCU",
                "angle": "low",
                "movement": "static",
                "composition": "陆沉居中偏上，黑伞占据画面上缘，底部1/4留字幕安全区"
              },
              "description": "陆沉撑着黑伞居高临下俯视苏晚，金丝眼镜后的眼神轻蔑，嘴角带着嘲弄的弧度",
              "lighting": "冷蓝雨夜侧光，镜片反光",
              "characters": [
                {
                  "character_id": "char_luchen",
                  "action": "举伞俯视苏晚，开口嘲讽",
                  "emotion": "讥讽"
                }
              ],
              "dialogue": [
                {
                  "line_id": "l_0003",
                  "speaker": "char_luchen",
                  "kind": "dialogue",
                  "text": "方案，我会替你好好完成的。",
                  "delivery": {
                    "emotion": "sarcastic",
                    "intensity": 0.4,
                    "speed": 0.9
                  }
                }
              ],
              "sfx": [
                "雨声",
                "雨打伞面声"
              ]
            },
            {
              "shot_id": "ep01_sc01_sh06",
              "duration": {
                "hint_s": 4.0
              },
              "framing": {
                "shot_size": "CU",
                "angle": "eye_level",
                "movement": "push_in",
                "composition": "苏晚面部居中偏上，五官清晰，底部1/4留字幕安全区"
              },
              "description": "苏晚脸部特写，雨水顺着脸颊流下，分不清是雨还是泪，她咬紧嘴唇直视陆沉，眼神由委屈转为愤怒",
              "lighting": "冷蓝雨夜光打湿面部，眼中反光",
              "characters": [
                {
                  "character_id": "char_suwan",
                  "action": "咬紧嘴唇，直视陆沉",
                  "emotion": "委屈转为愤怒"
                }
              ],
              "dialogue": [
                {
                  "line_id": "l_0004",
                  "speaker": "char_suwan",
                  "kind": "dialogue",
                  "text": "那是我熬了三个月的方案。",
                  "delivery": {
                    "emotion": "angry",
                    "intensity": 0.6,
                    "speed": 1.0
                  }
                }
              ],
              "sfx": [
                "雨声"
              ]
            },
            {
              "shot_id": "ep01_sc01_sh07",
              "duration": {
                "hint_s": 4.0
              },
              "framing": {
                "shot_size": "MS",
                "angle": "eye_level",
                "movement": "pull_out",
                "composition": "陆沉将伞塞入苏晚手中并转身，两人居中偏上，底部1/4留字幕安全区"
              },
              "description": "陆沉把黑伞塞进苏晚手里，说完转身走进雨中，背影渐渐被雨幕吞没，苏晚握紧伞柄站在原地",
              "lighting": "冷蓝雨夜，逆光剪影",
              "characters": [
                {
                  "character_id": "char_luchen",
                  "action": "把伞塞给苏晚后转身走进雨中",
                  "emotion": "冷淡"
                },
                {
                  "character_id": "char_suwan",
                  "action": "握紧伞柄站在原地",
                  "emotion": "不服输"
                }
              ],
              "dialogue": [
                {
                  "line_id": "l_0005",
                  "speaker": "char_luchen",
                  "kind": "dialogue",
                  "text": "证据呢？没有证据，就别再闹了。",
                  "delivery": {
                    "emotion": "sarcastic",
                    "intensity": 0.5,
                    "speed": 1.0
                  }
                }
              ],
              "sfx": [
                "雨声渐大"
              ]
            },
            {
              "shot_id": "ep01_sc01_sh08",
              "duration": {
                "hint_s": 3.5
              },
              "framing": {
                "shot_size": "CU",
                "angle": "low",
                "movement": "static",
                "composition": "苏晚面部与握伞的手同框，位于画面中上部，底部1/4留字幕安全区"
              },
              "description": "苏晚特写，雨水顺着湿发滴落，她握紧伞柄指节发白，眼神倔强地望向陆沉离去的方向",
              "lighting": "冷蓝雨夜侧逆光，雨丝清晰",
              "characters": [
                {
                  "character_id": "char_suwan",
                  "action": "握紧伞柄，望向雨中",
                  "emotion": "倔强，愤怒"
                }
              ],
              "dialogue": [
                {
                  "line_id": "l_0006",
                  "speaker": "char_suwan",
                  "kind": "dialogue",